,link,title,summary,published_date,keywords,external_links
53,https://philadelphia.cbslocal.com/2021/12/01/brotherly-love-musicopia-catherine-charlton/,"Brotherly Love: For Nearly 50 Years, Musicopia Giving Philadelphia Children Gift Of Music","PHILADELPHIA (CBS) — For almost 50 years, a Philadelphia organization has been giving children the gift of music. Eyewitness News caught up with them and their unique giveaway this week.In Spring Garden, a humble warehouse space is a wonderland for teachers. It's here that Musicopia gave away instruments.READ MORE: What We Know About 17-Year-Old Latif Williams, Wanted For Murder Of Temple Student Samuel Collington'Music teachers and administrators can make an appointment, come select the instruments they are looking for, for their schools and then take them and have them,' Catherine Charlton, the executive director of Musicopia, told CBS3.",2021-12-01 13:14:36,"['musicopia', ' philadelphia news', ' brotherly love', ' ukee washington', ' catherine charlton']","{'https://philadelphia.cbslocal.com/2021/12/04/donald-grier-townsend-new-castle-county-delaware-triple-homicide/', 'https://philadelphia.cbslocal.com/2021/12/05/philadelphia-commerce-director-michael-rashid-resigns-anti-semitic-abused-staff/', 'https://philadelphia.cbslocal.com/2021/12/04/chester-pedestrians-church-driver-crash-police/', 'https://philadelphia.cbslocal.com/2021/12/06/ben-simmons-damian-lillard-philadelphia-sixers-portland-trail-blazers/', 'https://philadelphia.cbslocal.com/2021/12/04/kristhie-alcazar-new-jersey-penns-grove-salem-county-mother-infant-stabbing-murder/', 'https://philadelphia.cbslocal.com/2021/12/05/doylestown-buckingham-township-bucks-county-house-fire-man-dead/', 'https://philadelphia.cbslocal.com/2021/12/04/covid19-omicron-variant-reported-philadelphia-new-jersey/', 'https://philadelphia.cbslocal.com/2021/12/04/carroll-park-kensington-philadelphia-pennsylvania-gun-violence-shooting-double-lansdowne-avenue-westmoreland-homicide/', 'https://philadelphia.cbslocal.com/2021/12/04/philadelphia-winter-holiday-parade-hanukkah-christmas-kwanzaa-chinese-new-year-charlie-manuel/', 'https://philadelphia.cbslocal.com/2021/12/05/philadelphia-shooting-kensington-gun-violence-men-dead/'}"
54,https://nypost.com/2021/12/01/philadelphia-teen-shot-18-times-at-bus-stop-amid-homicide-record/,Philadelphia teen shot 18 times at bus stop amid city's all-time homicide record,"A 14-year-old Philadelphia boy was shot 18 times while waiting at a bus stop Monday afternoon — over an apparent social media beef.



Samir Jefferson, a ninth-grader at Thomas Edison High School, was waiting for a bus at about 3:30 p.m. Monday when two gunmen jumped out of a car and opened fire, WPVI reported.



The teen, who was standing near a Rite Aid pharmacy in the city's Feltonville section, may have been targeted in the attack due to taunts on social media, sources told the station. 



He was later pronounced dead at Temple University Hospital.",2021-12-01 21:07:19,['Copyright 2021 NYP Holdings. All rights reserved.'],set()
55,https://www.foxnews.com/us/temple-university-samuel-collington-latif-williams-murder-investigation,Suspect in shooting death of Temple University student arrested for carjacking in July then released,"The 17-year-old suspect in the murder of a Temple University student over the weekend was arrested and charged earlier this year for a ""gunpoint carjacking"" but was released after prosecutors withdrew the case because a key witness failed to testify in court, a report says. Latif Williams, on Wednesday night, turned himself in to the Philadelphia Police Department's Homicide Unit following the killing of 21-year-old Samuel Collington on Sunday. Officers that day responded to a 911 call for a person with a gun in the city's north side and found Collington with gunshot wounds to his chest and back.",2021-12-02 16:23:38,[],set()
56,https://www.cnn.com/videos/us/2021/12/02/oxford-high-school-shooting-update-prokupecz-dnt-newday-vpx.cnn,Suspect charged as adult in Michigan school shooting,"WFMZ-TV 69 News provides news, weather, traffic, sports and family programming for the Lehigh Valley, Berks County, Southeastern Pa., Poconos and Western NJ including Allentown, Bethlehem, Easton, Reading, Kutztown, Emmaus, Quakertown, Stroudsburg, Philadelphia, Jim Thorpe, Doylestown, Phillipsburg, Flemington, Wilmington, and Newark.

This website is not intended for users located within the European Economic Area.

Advertising:
 Ad Choices
 | 
Do Not Sell My Info (cookies): Choices Do Not Sell",2021-12-02 11:40:10,"['us', ' Michigan school shooting: Suspect is charged as an adult - CNN Video']",set()
57,https://philadelphia.cbslocal.com/2021/11/29/holmesburg-northeast-philadelphia-shooting-homeowner-intruder/,Homeowner Shoots Intruder Inside Holmesburg Home,"PHILADELPHIA (CBS) — A homeowner opened fire on an intruder in Holmesburg on Sunday night, police say. The shooting happened around 11 p.m. on the 4700 block of Ashville Street. 

Police say they arrived to find a 31-year-old suspect shot in the face in the basement.
He was taken to the hospital, where he's listed in critical condition.
 ©2021 CBS Broadcasting Inc. All Rights Reserved. Powered by WordPress VIP",2021-11-29 06:21:16,"['northeast philadelphia shooting', ' philadelphia shooting', ' philly shooting', ' philadelphia gun violence', ' northeast philadelphia gun violence', ' holmesburg']","{'https://philadelphia.cbslocal.com/2021/12/04/donald-grier-townsend-new-castle-county-delaware-triple-homicide/', 'https://philadelphia.cbslocal.com/2021/12/05/philadelphia-commerce-director-michael-rashid-resigns-anti-semitic-abused-staff/', 'https://philadelphia.cbslocal.com/2021/12/04/chester-pedestrians-church-driver-crash-police/', 'https://philadelphia.cbslocal.com/2021/12/06/ben-simmons-damian-lillard-philadelphia-sixers-portland-trail-blazers/', 'https://philadelphia.cbslocal.com/2021/12/04/kristhie-alcazar-new-jersey-penns-grove-salem-county-mother-infant-stabbing-murder/', 'https://philadelphia.cbslocal.com/2021/12/05/doylestown-buckingham-township-bucks-county-house-fire-man-dead/', 'https://philadelphia.cbslocal.com/2021/12/04/covid19-omicron-variant-reported-philadelphia-new-jersey/', 'https://philadelphia.cbslocal.com/2021/12/04/carroll-park-kensington-philadelphia-pennsylvania-gun-violence-shooting-double-lansdowne-avenue-westmoreland-homicide/', 'https://philadelphia.cbslocal.com/2021/12/04/philadelphia-winter-holiday-parade-hanukkah-christmas-kwanzaa-chinese-new-year-charlie-manuel/', 'https://philadelphia.cbslocal.com/2021/12/05/philadelphia-shooting-kensington-gun-violence-men-dead/'}"
58,https://www.cnn.com/videos/us/2021/11/30/michigan-high-school-shooting-supect-custody-vpx.cnn,Michigan School Shooting: Here's what we know,"WFMZ-TV 69 News provides news, weather, traffic, sports and family programming for the Lehigh Valley, Berks County, Southeastern Pa., Poconos and Western NJ including Allentown, Bethlehem, Easton, Reading, Kutztown, Emmaus, Quakertown, Stroudsburg, Philadelphia, Jim Thorpe, Doylestown, Phillipsburg, Flemington, Wilmington, and Newark.

This website is not intended for users located within the European Economic Area.

Advertising:
 Ad Choices
 | 
Do Not Sell My Info (cookies): Choices Do Not Sell",2021-12-01 01:55:49,"['us', "" Michigan High School shooting: Here's what we know - CNN Video""]",set()
59,https://www.cnn.com/videos/us/2021/12/01/michigan-high-school-shooting-prokupecz-dnt-newday-vpx.cnn,'This is actually happening': Student speaks out after school shooting,"WFMZ-TV 69 News provides news, weather, traffic, sports and family programming for the Lehigh Valley, Berks County, Southeastern Pa., Poconos and Western NJ including Allentown, Bethlehem, Easton, Reading, Kutztown, Emmaus, Quakertown, Stroudsburg, Philadelphia, Jim Thorpe, Doylestown, Phillipsburg, Flemington, Wilmington, and Newark.

This website is not intended for users located within the European Economic Area.

Advertising:
 Ad Choices
 | 
Do Not Sell My Info (cookies): Choices Do Not Sell",2021-12-01 11:52:29,"['us', "" Michigan high school shooting: 'This is actually happening'"", ' student later recalls - CNN Video']",set()
60,https://www.cnn.com/videos/us/2021/11/30/michigan-high-school-shooting-supect-custody-vpx.cnn,Authorities say at least 3 people killed in Michigan high school shooting,"WFMZ-TV 69 News provides news, weather, traffic, sports and family programming for the Lehigh Valley, Berks County, Southeastern Pa., Poconos and Western NJ including Allentown, Bethlehem, Easton, Reading, Kutztown, Emmaus, Quakertown, Stroudsburg, Philadelphia, Jim Thorpe, Doylestown, Phillipsburg, Flemington, Wilmington, and Newark.

This website is not intended for users located within the European Economic Area.

Advertising:
 Ad Choices
 | 
Do Not Sell My Info (cookies): Choices Do Not Sell",2021-11-30 21:18:08,"['us', "" Michigan High School shooting: Here's what we know - CNN Video""]",set()
61,https://www.cnn.com/videos/us/2021/11/30/michigan-high-school-shooting-supect-custody-vpx.cnn,Suspect in custody after several people injured in high school shooting,"WFMZ-TV 69 News provides news, weather, traffic, sports and family programming for the Lehigh Valley, Berks County, Southeastern Pa., Poconos and Western NJ including Allentown, Bethlehem, Easton, Reading, Kutztown, Emmaus, Quakertown, Stroudsburg, Philadelphia, Jim Thorpe, Doylestown, Phillipsburg, Flemington, Wilmington, and Newark.

This website is not intended for users located within the European Economic Area.

Advertising:
 Ad Choices
 | 
Do Not Sell My Info (cookies): Choices Do Not Sell",2021-11-30 20:16:09,"['us', "" Michigan High School shooting: Here's what we know - CNN Video""]",set()
62,https://philadelphia.cbslocal.com/2021/12/01/philadelphia-15th-street-septa-assault-juveniles-attack-fight-market-frankford-line/,Woman Assaulted By Juvenile Suspects On SEPTA Train Tuesday Night,"PHILADELPHA (CBS) — An investigation is underway after SEPTA officials say a 27-year-old woman was assaulted on a Market-Frankford Line train Tuesday evening. The incident happened around 6:40 p.m.The victim and the suspects, who are juveniles, got on the train at 15th Street, a SEPTA spokesperson told CBS3 Wednesday morning. Around 5th Street, the train 'accelerated, and the two juveniles bumped into the' woman. The woman pushed them back.READ MORE: Police Investigating After ATM Explodes At Kensington Gas StationThe three argued before juveniles, a male and a female, hit the woman once each at 2nd Street.",2021-12-01 06:20:29,"['philadelphia', ' 15th street', ' septa', ' assault', ' juveniles', ' attack', ' fight', ' market-frankford line']","{'https://philadelphia.cbslocal.com/2021/12/04/donald-grier-townsend-new-castle-county-delaware-triple-homicide/', 'https://philadelphia.cbslocal.com/2021/12/05/philadelphia-commerce-director-michael-rashid-resigns-anti-semitic-abused-staff/', 'https://philadelphia.cbslocal.com/2021/12/04/chester-pedestrians-church-driver-crash-police/', 'https://philadelphia.cbslocal.com/2021/12/06/ben-simmons-damian-lillard-philadelphia-sixers-portland-trail-blazers/', 'https://philadelphia.cbslocal.com/2021/12/04/kristhie-alcazar-new-jersey-penns-grove-salem-county-mother-infant-stabbing-murder/', 'https://philadelphia.cbslocal.com/2021/12/05/doylestown-buckingham-township-bucks-county-house-fire-man-dead/', 'https://philadelphia.cbslocal.com/2021/12/04/covid19-omicron-variant-reported-philadelphia-new-jersey/', 'https://philadelphia.cbslocal.com/2021/12/04/carroll-park-kensington-philadelphia-pennsylvania-gun-violence-shooting-double-lansdowne-avenue-westmoreland-homicide/', 'https://philadelphia.cbslocal.com/2021/12/04/philadelphia-winter-holiday-parade-hanukkah-christmas-kwanzaa-chinese-new-year-charlie-manuel/', 'https://philadelphia.cbslocal.com/2021/12/05/philadelphia-shooting-kensington-gun-violence-men-dead/'}"
63,https://www.usatoday.com/story/news/nation/2021/12/01/14-year-old-shot-killed-philadelphia/8819500002/,"A 14-year-old was chased and shot 18 times while waiting for a bus in Philadelphia, reports say","Family speaks out after teen is killed while waiting for a busSamir Jefferson's family is speaking out after police say the 14-year-old was waiting for the bus when he was chased by two people and shot 18 times.A Philadelphia family is mourning the loss of their 14-year-old son after he was shot nearly 20 times while waiting for a bus.According to 3 CBS Philly, Samir Jefferson was ambushed in broad daylight in North Philadelphia on Monday by two assailants. 'A vehicle, maybe two, pull up. Two males get out and start shooting at him, chasing him,' Philadelphia Police Chief Inspector Scott Small told the outlet.",2021-12-01 13:42:11,[],set()
64,https://philadelphia.cbslocal.com/2021/11/29/holmesburg-northeast-philadelphia-shooting-homeowner-intruder/,Philadelphia Police: Homeowner Shoots Intruder Inside Holmesburg Home,"(CBS3)November 29, 2021 A homeowner opened fire on an intruder in Holmesburg on Sunday night, police say. The shooting happened around 11 p.m. on the 4700 block of Ashville Street. Police say they arrived to find a 31-year-old suspect shot in the face in the basement.He was taken to the hospital, where he's listed in critical condition. CBS Local Digital Media personalizes the global reach of CBS-owned and operated television and radio stations with a local perspective.",2021-11-29 22:24:58,"['northeast philadelphia shooting', ' philadelphia shooting', ' philly shooting', ' philadelphia gun violence', ' northeast philadelphia gun violence', ' holmesburg']","{'https://philadelphia.cbslocal.com/2021/12/04/donald-grier-townsend-new-castle-county-delaware-triple-homicide/', 'https://philadelphia.cbslocal.com/2021/12/05/philadelphia-commerce-director-michael-rashid-resigns-anti-semitic-abused-staff/', 'https://philadelphia.cbslocal.com/2021/12/04/chester-pedestrians-church-driver-crash-police/', 'https://philadelphia.cbslocal.com/2021/12/06/ben-simmons-damian-lillard-philadelphia-sixers-portland-trail-blazers/', 'https://philadelphia.cbslocal.com/2021/12/04/kristhie-alcazar-new-jersey-penns-grove-salem-county-mother-infant-stabbing-murder/', 'https://philadelphia.cbslocal.com/2021/12/05/doylestown-buckingham-township-bucks-county-house-fire-man-dead/', 'https://philadelphia.cbslocal.com/2021/12/04/covid19-omicron-variant-reported-philadelphia-new-jersey/', 'https://philadelphia.cbslocal.com/2021/12/04/carroll-park-kensington-philadelphia-pennsylvania-gun-violence-shooting-double-lansdowne-avenue-westmoreland-homicide/', 'https://philadelphia.cbslocal.com/2021/12/04/philadelphia-winter-holiday-parade-hanukkah-christmas-kwanzaa-chinese-new-year-charlie-manuel/', 'https://philadelphia.cbslocal.com/2021/12/05/philadelphia-shooting-kensington-gun-violence-men-dead/'}"
65,https://philadelphia.cbslocal.com/2021/12/02/samir-jeffersons-mother-speaks-out-after-14-year-old-shot-18-times-killed-in-feltonville,"Samir Jefferson's Mother Speaks Out After 14-Year-Old Shot 18 Times, Killed In Feltonville","PHILADELPHIA (CBS) — Family and friends came together Thursday evening to remember a 14-year-old shot to death in Feltonville. Samir Jefferson was shot 18 times on Wyoming Avenue while waiting for the bus after school.

It's been an emotional week for Samir's family. A vigil and balloon release was held Thursday night for a life cut short.

'Everybody screaming, crying, it's devastating,' Desiree Goodson, Samir's mother, said.

Family members say Samir loved music, playing basketball, eating chicken alfredo and was always smiling.",2021-12-02 18:34:06,"['philadelphia', ' gun violence', ' samir jefferson', ' philadelphia teen killed', ' rite aid']","{'https://philadelphia.cbslocal.com/2021/12/04/donald-grier-townsend-new-castle-county-delaware-triple-homicide/', 'https://philadelphia.cbslocal.com/2021/12/05/philadelphia-commerce-director-michael-rashid-resigns-anti-semitic-abused-staff/', 'https://philadelphia.cbslocal.com/2021/12/04/chester-pedestrians-church-driver-crash-police/', 'https://philadelphia.cbslocal.com/2021/12/06/ben-simmons-damian-lillard-philadelphia-sixers-portland-trail-blazers/', 'https://philadelphia.cbslocal.com/2021/12/04/kristhie-alcazar-new-jersey-penns-grove-salem-county-mother-infant-stabbing-murder/', 'https://philadelphia.cbslocal.com/2021/12/05/doylestown-buckingham-township-bucks-county-house-fire-man-dead/', 'https://philadelphia.cbslocal.com/2021/12/04/covid19-omicron-variant-reported-philadelphia-new-jersey/', 'https://philadelphia.cbslocal.com/2021/12/04/carroll-park-kensington-philadelphia-pennsylvania-gun-violence-shooting-double-lansdowne-avenue-westmoreland-homicide/', 'https://philadelphia.cbslocal.com/2021/12/04/philadelphia-winter-holiday-parade-hanukkah-christmas-kwanzaa-chinese-new-year-charlie-manuel/', 'https://philadelphia.cbslocal.com/2021/12/05/philadelphia-shooting-kensington-gun-violence-men-dead/'}"
66,https://philadelphia.cbslocal.com/2021/12/01/samuel-sean-collington-temple-student-killed-attempted-robbery-suspect/,Philadelphia Police ID Suspect In Deadly Shooting Of Temple Student Samuel Collington,"PHILADELPHIA (CBS) — Philadelphia police have identified a suspect in the killing of a Temple University student on Sunday. Samuel Sean Collington, 21, was shot twice in the chest following an attempted robbery near his off-campus apartment Sunday.Police confirm they have a solid suspect in the case.READ MORE: 3 Injured, Including Teen, After Gas Explosion Inside South Philadelphia HomeThree sets of Philadelphia parents are now planning funerals for their children — all gunned down on city streets.",2021-12-01 05:00:25,"['latif williams  samuel sean collington', ' temple student killed attempted robbery', ' person of interest', ' surveillance video', ' killed off campus']","{'https://philadelphia.cbslocal.com/2021/12/04/donald-grier-townsend-new-castle-county-delaware-triple-homicide/', 'https://philadelphia.cbslocal.com/2021/12/05/philadelphia-commerce-director-michael-rashid-resigns-anti-semitic-abused-staff/', 'https://philadelphia.cbslocal.com/2021/12/04/chester-pedestrians-church-driver-crash-police/', 'https://philadelphia.cbslocal.com/2021/12/06/ben-simmons-damian-lillard-philadelphia-sixers-portland-trail-blazers/', 'https://philadelphia.cbslocal.com/2021/12/04/kristhie-alcazar-new-jersey-penns-grove-salem-county-mother-infant-stabbing-murder/', 'https://philadelphia.cbslocal.com/2021/12/05/doylestown-buckingham-township-bucks-county-house-fire-man-dead/', 'https://philadelphia.cbslocal.com/2021/12/04/covid19-omicron-variant-reported-philadelphia-new-jersey/', 'https://philadelphia.cbslocal.com/2021/12/04/carroll-park-kensington-philadelphia-pennsylvania-gun-violence-shooting-double-lansdowne-avenue-westmoreland-homicide/', 'https://philadelphia.cbslocal.com/2021/12/04/philadelphia-winter-holiday-parade-hanukkah-christmas-kwanzaa-chinese-new-year-charlie-manuel/', 'https://philadelphia.cbslocal.com/2021/12/05/philadelphia-shooting-kensington-gun-violence-men-dead/'}"
67,https://nypost.com/2021/11/29/temple-student-killed-in-philadelphia-as-city-passes-500-homicides/,Philadelphia college student killed as city surges past 500 homicides in 2021,"A Temple University student just months away from graduating was fatally shot in Philadelphia, which has seen more than 500 murders this year alone, college officials said.



Samuel Sean Collington, 21, of Prospect Park, Pa., died from fatal gunshot wounds during an apparent attempted robbery Sunday afternoon near the North Philadelphia campus, Temple University said in a statement.



'This attack … only further highlights the senseless gun violence that continues to grip the city of Philadelphia,' said Temple's executive director of public safety, Charlie Leone.",2021-11-29 14:55:45,['Copyright 2021 NYP Holdings. All rights reserved.'],set()
68,https://philadelphia.cbslocal.com/2021/11/29/philadelphia-gun-violence-kanye-davis-mother-speaks/,"EXCLUSIVE: Heartbroken Mother Of 16-Year-Old Kanye Davis Speaks After Son Shot 8 Times, Killed","PHILADELPHIA (CBS) — The gun violence crisis in Philadelphia has left a permanent mark in the hearts of another family. A mother is talking only to CBS3 about her son who was shot and killed Sunday night.Police sources say 16-year-old Kanye Davis was sitting in an enclosed set of stairs when two cars drove down Diamond Street and opened fire. Sources described it as an ambush-style hit.READ MORE: Philadelphia City Council Calling On SEPTA To Take Action After Several Violent, High-Profile Incidents On Transit System'It was just me and him over the years.",2021-11-29 18:08:38,"['north philadelphia', ' shooting', ' deadly', ' gun violence', ' diamond street', ' teen', '']","{'https://philadelphia.cbslocal.com/2021/12/04/donald-grier-townsend-new-castle-county-delaware-triple-homicide/', 'https://philadelphia.cbslocal.com/2021/12/05/philadelphia-commerce-director-michael-rashid-resigns-anti-semitic-abused-staff/', 'https://philadelphia.cbslocal.com/2021/12/04/chester-pedestrians-church-driver-crash-police/', 'https://philadelphia.cbslocal.com/2021/12/06/ben-simmons-damian-lillard-philadelphia-sixers-portland-trail-blazers/', 'https://philadelphia.cbslocal.com/2021/12/04/kristhie-alcazar-new-jersey-penns-grove-salem-county-mother-infant-stabbing-murder/', 'https://philadelphia.cbslocal.com/2021/12/05/doylestown-buckingham-township-bucks-county-house-fire-man-dead/', 'https://philadelphia.cbslocal.com/2021/12/04/covid19-omicron-variant-reported-philadelphia-new-jersey/', 'https://philadelphia.cbslocal.com/2021/12/04/carroll-park-kensington-philadelphia-pennsylvania-gun-violence-shooting-double-lansdowne-avenue-westmoreland-homicide/', 'https://philadelphia.cbslocal.com/2021/12/04/philadelphia-winter-holiday-parade-hanukkah-christmas-kwanzaa-chinese-new-year-charlie-manuel/', 'https://philadelphia.cbslocal.com/2021/12/05/philadelphia-shooting-kensington-gun-violence-men-dead/'}"
69,https://philadelphia.cbslocal.com/2021/12/03/covid19-omicron-variant-reported-philadelphia-new-jersey/,"First Confirmed Case Of COVID-19 Omicron Variant Reported In Philadelphia, New Jersey",PHILADELPHIA (CBS) — Philadelphia health officials say the first confirmed case of the new COVID-19 omicron variant has been identified in the city. Officials say a male resident in his 30's from Northwest Philadelphia has tested positive for the omicron variant.The health department is working to get more information regarding the case and is working with the state health department and the U.S. Centers for Disease Control and Prevention.READ MORE: Family Of Fallen Delaware County Firefighter Has Mortgage Fully Paid OffThe city says they were first notified of this through the state and the health commissioner says they believe there may be more cases out there.,2021-12-03 19:38:26,"['omicron', ' covid-19', ' coronavirus', ' philadelphia news', ' omicron philadelphia', ' coronavirus philadelphia', ' omicron in philadelphia']","{'https://philadelphia.cbslocal.com/2021/12/04/donald-grier-townsend-new-castle-county-delaware-triple-homicide/', 'https://philadelphia.cbslocal.com/2021/12/05/philadelphia-commerce-director-michael-rashid-resigns-anti-semitic-abused-staff/', 'https://philadelphia.cbslocal.com/2021/12/04/chester-pedestrians-church-driver-crash-police/', 'https://philadelphia.cbslocal.com/2021/12/06/ben-simmons-damian-lillard-philadelphia-sixers-portland-trail-blazers/', 'https://philadelphia.cbslocal.com/2021/12/04/kristhie-alcazar-new-jersey-penns-grove-salem-county-mother-infant-stabbing-murder/', 'https://philadelphia.cbslocal.com/2021/12/05/doylestown-buckingham-township-bucks-county-house-fire-man-dead/', 'https://philadelphia.cbslocal.com/2021/12/04/covid19-omicron-variant-reported-philadelphia-new-jersey/', 'https://philadelphia.cbslocal.com/2021/12/04/carroll-park-kensington-philadelphia-pennsylvania-gun-violence-shooting-double-lansdowne-avenue-westmoreland-homicide/', 'https://philadelphia.cbslocal.com/2021/12/04/philadelphia-winter-holiday-parade-hanukkah-christmas-kwanzaa-chinese-new-year-charlie-manuel/', 'https://philadelphia.cbslocal.com/2021/12/05/philadelphia-shooting-kensington-gun-violence-men-dead/'}"
