,link,title,summary,published_date,keywords,external_links
209,https://www.dailymail.co.uk/wires/reuters/article-10279389/NHL-roundup-Patrick-Kanes-SO-goal-propels-Blackhawks-win.html,NHL roundup: Patrick Kane's SO goal propels Blackhawks to win,"Published: 03:29 EST, 6 December 2021 | Updated: 03:29 EST, 6 December 2021 Patrick Kane scored the only goal in the shootout Sunday night as the visiting Chicago Blackhawks edged the New York Islanders, 3-2, in Elmont, N.Y. Noah Dobson forced overtime by scoring with 3.6 seconds left for the Islanders, but neither team generated a serious threat in overtime before Kane, shooting second for the Blackhawks, shuffled the puck several times before coming to a stop and firing a shot past Semyon Varlamov into the upper right corner of the net.",2021-12-06 08:29:28,"['dailymail', 'wires', 'reuters']",set()
210,https://ca.news.yahoo.com/2-oregon-utah-meet-again-202841279.html,"Take 2: Oregon, Utah meet again with Pac-12 on the line","Yahoo Sports Canada VideosIt's been a special start for the Toronto Maple Leafs, who are the hottest team in the NHL right now. But for reasons associated to past failure, the level of excitement with the market doesn't do the team's performance justice.It would be a shame if this run wasn't being enjoyed in the manner it should.Brian Williams announced his retirement Thursday, ending a five-decade career that saw him rise to prominence as one of Canada's leading authorities on the Olympic Games.",2021-12-02 20:28:41,[],set()
211,https://www.startribune.com/timberwolves-pacers-patched-together-lineup-moves-above-500/600122073,"Patched-together Timberwolves lineup beats Pacers, moves team about .500","Early on the Timberwolves knew forward Jaden McDaniels would miss Monday's game against Indiana because of flu-like symptoms. A game-time decision found forward Jarred Vanderbilt joining him, same reason. That meant the Wolves were without those two and injured guard Patrick Beverley. Or in other words: Perhaps the team's two best starting defenders and a trio relied on to inject energy into the Wolves lineup.

Who would pick up the slack?

Just about everybody, it turns out, in Minnesota's 100-98 victory over Indiana at Target Center.",2021-11-30 03:36:41,[],[]
212,https://www.nba.com/bulls/news/chuck-checks-bulls-look-open-december-big-road-win,Chuck Checks In: Bulls Look To Open December With Big Road Win,"GAME NIGHT FROM THE GARDEN IN NEW YORK:
Bulls ( 14-8, 7-4 on the road) at New York: ( 11-10, 5-6 at home) 6:30 CT
RADIO: 670 The Score: Chuck Swirsky and Bill Wennington: 6:15 CT pregame
TV: NBCSCH- Adam Amin and Stacey King, 6:30 p.m. CT 

LEADING SCORERS: Bulls- DeRozan (25.9 ppg), NY- Randle (19 ppg)
LEADING REBOUNDERS: Bulls: Vucevic: 11 per. NY: Randle- (10)
LEADING ASSISTS: Bulls- Ball (4.8), NY- Randle (5)

SERIES: 1-1

CCI PREVIEW: The month of December will bring some daunting matchups and it starts tonight as the Bulls battle the Knicks who are still trying to find themselves with lofty expectations to live up to.",2021-12-02 16:53:00,[],set()
213,https://www.medscape.com/viewarticle/963937,HIV: Syringe Services Fill a Gap in PrEP Access,"Not that long ago, a man in his mid-20s whom Morgan Farrington calls Kiddo showed up at her house with a fever, chills, and nausea. He was increasingly out of it. These were all signs of an abscess from missing a vein and using someone else's syringe, said Farrington, founder of Goodworks, in Huntsville, Alabama. But it wasn't just an abscess. It was four blood clots and sepsis. He'd been craving his next fix of heroin so hard, and the relief that comes from the act of shooting up itself, that he'd dug a 3-day-old blood shot — a used syringe with someone else's blood in it — out of the garbage and had used it.",2021-12-01 17:00:00,[],[]
214,https://ca.news.yahoo.com/latest-lions-vikings-pay-tribute-170344241.html,The Latest: Vikings' Thielen out for game with ankle injury,"The Latest from Week 13 of the NFL (all times EST):

___

3:10 p.m.

Minnesota wide receiver Adam Thielen has been downgraded to out for the game after hurting his left ankle on the game's opening drive of their matchup with the Lions

Thielen entered the game tied for the league lead with 10 receiving touchdowns.

He had one catch for no yards prior to leaving the game Sunday.

___

2:50 p.m.

Minnesota receiver Justin Jefferson has joined Odell Beckham Jr. and Randy Moss as the only players with 2,500 or more receiving yards in their first two seasons during in the Super Bowl era.",2021-12-05 20:17:24,[],set()
215,https://abcnews.go.com/Sports/wireStory/latest-hurts-minshew-eagles-jets-81568699,The Latest: Chargers' Joey Bosa evaluated for concussion,"The Latest from Week 13 of the NFL (all times EST):———2:00 p.m.Los Angeles Chargers defensive end Joey Bosa is being evaluated for a concussion after going out in the first quarter against the Cincinnati Bengals.Bosa went to the locker room after coming off the field under his own power.For the Bengals, linebacker Logan Wilson (right shoulder) and Markus Bailey (left shoulder) also left the game. Their return is questionable.The Chargers are leading the Bengals 24-0.———1:45 p.m.New kicker, same troubles for the New York Jets.",2021-12-05 17:03:01,"['Sports', ' Athlete injuries', ' Athlete health', ' NFL football', ' Professional football', ' Football', ' Jordan Howard', ' Gardner Minshew', ' Boston Scott', ' Corey Davis', ' Philadelphia Eagles', ' NFC East', ' National Football Conference', ' National Football League', ' New York Jets', ' AFC ']",set()
216,https://sports.yahoo.com/seiya-suzuki-rumors-red-sox-141249340.html?src=rss,"Seiya Suzuki rumors: Red Sox, two AL East foes aggressively pursuing Japanese star","Reitz High school graduate Elijah Dunham named Yankees' ""Breakout Player"" in Arizona Fall League.For two seasons, Detroit Tigers third baseman Jeimer Candelario has been the best player on the roster. Finally, the 28-year-old is getting help.Let's face it: some of our favorite films are way too unrealistic when it comes to depicting real historical events. But these 20 take the cake.Today's guest columnist is Andrew Zimbalist, professor of economics at Smith College and author of several books on the economics of baseball.",2021-12-06 14:12:49,[],set()
217,https://www.dailymail.co.uk/wires/reuters/article-10257315/NBA-roundup-Nikola-Jokics-return-helps-Nuggets-end-skid.html?ns_mchannel=rss&ns_campaign=1490&ito=1490,NBA roundup: Nikola Jokic's return helps Nuggets end skid,"Reigning league MVP Nikola Jokic returned from a four-game injury absence to account for 24 points, a game-high 15 rebounds and a team-high seven assists as the Denver Nuggets defeated the host Miami Heat 120-111 on Monday night.

Denver shot 58.1 percent from the floor, including 18-for-35 on 3-pointers (51.4 percent).

Jokic, who had been out with a sprained right wrist, made 9 of 14 shots from the floor and 5 of 6 on free throws as Denver snapped a season-worst six-game losing streak.

Aaron Gordon added 20 points for the Nuggets (10-10), who improved to 3-6 on the road.",2021-11-30 07:14:08,"['dailymail', 'wires', 'reuters']",set()
218,https://sports.yahoo.com/three-things-know-lamelo-ball-150921857.html?src=rss,"Three things to know: LaMelo Ball will be a superstar, Giannis shows him one path","This content is not available due to your privacy preferences. Update your settings here to see it.

Three Things is NBC's five-days-a-week wrap-up of the night before in the NBA. Check out NBCSports.com every weekday morning to catch up on what you missed the night before plus the rumors, drama, and dunks going that make the NBA great.

1) LaMelo Ball will be a superstar, Giannis shows him one path

LaMelo Ball will never be Giannis Antetokounmpo, because nobody else will ever be Giannis Antetokounmpo.",2021-12-02 15:09:21,[],set()
219,https://www.reuters.com/lifestyle/sports/nba-roundup-stephen-curry-warriors-halt-suns-18-game-win-streak-2021-12-04/,"NBA roundup: Stephen Curry, Warriors halt Suns' 18-game win streak","2021-12-04 07:40:28 GMT+00:00 - The Golden State Warriors ended the Phoenix Suns' 18-game winning streak and reclaimed the top spot in the Western Conference on Friday night, riding a long-range barrage led by Stephen Curry to a 118-96 victory in San Francisco.Curry finished with a game-high-tying 23 points, a majority coming on six of the Warriors' 19 3-pointers, as Golden State avenged a 104-96 loss at Phoenix on Tuesday by handing the Suns their first loss since Oct. 27.The win was the Warriors' 11th straight at home, all of which have come by at least 10 points.",2021-12-04 07:40:28,"['BASK', 'BKN', 'NBA', 'SPO', 'US']",set()
220,https://therookiewire.usatoday.com/lists/rookie-wire-power-rankings-december-1-scottie-barnes-cade-cunningham/,"Rookie Wire Power Rankings: Scottie Barnes, Cade Cunningham lead the way","The rookie class continues to put up strong, individual performances to start the 2021-22 season as some new candidates have started to emerge over the last few weeks.
Toronto Raptors guard Scottie Barnes has likely emerged as the top rookie to this point of the season. He puts up numbers on a nightly basis and that should only continue as the Raptors ask him to shoot more 3-pointers per game (more on that later).
The class has dealt with some recent injuries with the likes of Jalen Green and Evan Mobley missing time while Jalen Suggs and Bones Hyland will be out for the foreseeable future.",2021-12-01 13:59:20,['Rookie Wire takes a look at the top first-year players over the last two weeks of the 2021-22 season.'],set()
221,https://www.thestar.com/sports/football/2021/12/05/the-latest-hurts-out-minshew-in-for-the-eagles-vs-jets.html,The Latest: Chargers' Joey Bosa evaluated for concussion,"The Latest from Week 13 of the NFL (all times EST):___2:00 p.m.Los Angeles Chargers defensive end Joey Bosa is being evaluated for a concussion after going out in the first quarter against the Cincinnati Bengals.Bosa went to the locker room after coming off the field under his own power.For the Bengals, linebacker Logan Wilson (right shoulder) and Markus Bailey (left shoulder) also left the game. Their return is questionable.The Chargers are leading the Bengals 24-0. ___1:45 p.m.New kicker, same troubles for the New York Jets.",2021-12-05 18:45:00,"['sports', 'FEED_automated', 'FEEDPROVIDER_CP', 'smg_football_nfl', 'smg_football', 'CP_URGENCY_3']",set()
222,https://apnews.com/b323b45deb137e1328526512758ed9ff,The Latest: Cards' Murray 4th-youngest to 10K passing yards,"The Latest from Week 13 of the NFL (all times EST):___2:30 p.m. Arizona Cardinals quarterback Kyler Murray became the fourth-youngest player with 10,000 career yards passing at 24 years, 120 days, according to NFL research.Murray came into the matchup against Chicago with 9,969 yards. The third-year pro threw for 73 yards and two touchdowns in the first half. He also ran for a score, helping the Cardinals grab a 21-7 lead.Drew Bledsoe (23 years, 299 days), Jameis Winston (23 years, 303 days) and Dan Marino (24 years, 63 days) are the only players to reach 10,000 yards passing at a younger age.",2021-12-05 16:56:08,['yes'],set()
223,https://apnews.com/b323b45deb137e1328526512758ed9ff,The Latest: Chargers' Joey Bosa evaluated for concussion,"The Latest from Week 13 of the NFL (all times EST):———2:00 p.m.Los Angeles Chargers defensive end Joey Bosa is being evaluated for a concussion after going out in the first quarter against the Cincinnati Bengals.Bosa went to the locker room after coming off the field under his own power.For the Bengals, linebacker Logan Wilson (right shoulder) and Markus Bailey (left shoulder) also left the game. Their return is questionable.The Chargers are leading the Bengals 24-0.———1:45 p.m.New kicker, same troubles for the New York Jets.",2021-12-05 18:51:12,['yes'],set()
224,https://www.chron.com/sports/article/No-6-Villanova-tops-Penn-71-56-at-Palestra-for-16667668.php,No. 6 Villanova tops Penn 71-56 at Palestra for Big 5 win,"1of12Villanova's Jermaine Samuels (23) goes up for a shot between Pennsylvania's Jonah Charles (2) and Michael Moshkovitz (11) during the first half of an NCAA college basketball game, Wednesday, Dec. 1, 2021, in Philadelphia.Matt Slocum/APShow MoreShow Less 2of12Villanova's Collin Gillespie (2) goes up for a shot against Pennsylvania's Jelani Williams (5) during the first half of an NCAA college basketball game, Wednesday, Dec. 1, 2021, in Philadelphia.Matt Slocum/APShow MoreShow Less 4of12Villanova's Caleb Daniels, right, goes up for a shot against Pennsylvania's Lucas Monroe during the first half of an NCAA college basketball game, Wednesday, Dec.",2021-12-02 02:48:52,[],set()
225,https://www.sfgate.com/sports/article/Young-makes-key-free-throws-leads-Hawks-past-16667783.php,"Young makes key free throws, leads Hawks past Pacers 114-111","1of9Atlanta Hawks' Delon Wright (0) goes to the basket against Indiana Pacers' Oshae Brissett (12) during the first half of an NBA basketball game Wednesday, Dec. 1, 2021, in Indianapolis.Darron Cummings/APShow MoreShow Less 2of9Atlanta Hawks' Trae Young (11) is defended by Indiana Pacers' Chris Duarte during the first half of an NBA basketball game Wednesday, Dec. 1, 2021, in Indianapolis.Darron Cummings/APShow MoreShow Less 4of9Atlanta Hawks' Delon Wright (0) goes to the basket against Indiana Pacers' Jeremy Lamb (26) during the first half of an NBA basketball game Wednesday, Dec.",2021-12-02 02:38:46,[],set()
226,https://boston.cbslocal.com/2021/12/02/brad-stevens-jayson-tatum-anonymous-comments-ridiculous-idiotic-celtics-nba/,Brad Stevens Dismisses 'Ridiculous' And 'Idiotic' Anonymous Comments About Jayson Tatum's Attitude,"BOSTON (CBS) — An unnamed assistant coach recently shared an unflattering opinion on Jayson Tatum, saying that the Celtics star cares more about big scoring nights than he does about winning. Those comments are not sitting well with Celtics president of basketball ops Brad Stevens.In a piece by ESPN's Tim Bontempts last week on Boston's up-and-down start to the 2021-22 season — and the issues that have plagued the team over recent years — an anonymous Eastern Conference assistant coach said that 'Jayson Tatum is about Jayson Tatum.",2021-12-02 15:45:01,"['jayson tatum', ' brad stevens', ' boston celtics', ' nba']","{'https://boston.cbslocal.com/2021/12/02/cbs-holiday-tv-special-schedule-2021-rudolph-frosty-adele-lady-gaga/', 'https://boston.cbslocal.com/2021/12/05/vincenzo-lirosi-missing-university-of-new-hampshire-student/', 'https://boston.cbslocal.com/2021/12/04/omicron-variant-covid-massachusetts/', 'https://boston.cbslocal.com/2021/12/06/medford-mayor-apologizes-incorrect-menorah-display/', 'https://boston.cbslocal.com/2021/12/06/littleton-nh-93-crash-girls-killed/', 'https://boston.cbslocal.com/2021/12/03/kellys-roast-beef-location-salem-new-hampshire/', 'https://boston.cbslocal.com/2021/12/05/patriots-take-over-top-seed-in-afc-after-ravens-lose-to-steelers/', 'https://boston.cbslocal.com/2021/12/06/umass-memorial-health-covid-vaccine-mandate-firings/', 'https://boston.cbslocal.com/2021/12/04/missing-unh-student-vincenzo-lirosi-durham-police/', 'https://boston.cbslocal.com/2021/12/05/cultivate-care-farm-bolton-death/'}"
227,https://www.startribune.com/young-makes-key-free-throws-leads-hawks-past-pacers-114-111/600122813/,"Young makes key free throws, leads Hawks past Pacers 114-111","INDIANAPOLIS — Trae Young made two crucial free throws in the final seconds of the game to help the Atlanta Hawks fend off the Indiana Pacers 114-111 on Wednesday night. Pacers rookie Chris Duarte came up with a steal late in the game, but was unable to convert a contested layup. Young was subsequently fouled and made the final two of his 33 points. After the final buzzer, Pacers coach Rick Carlisle yelled at the referees about the lack of a call on the Duarte drive. Young also had 10 assists and eight rebounds for the Hawks, who shot 51.",2021-12-02 02:38:46,[],[]
228,https://www.startribune.com/the-latest-vikings-thielen-hurts-ankle-early-vs-lions/600124021/,The Latest: Vikings' Thielen hurts ankle early vs. Lions,"The Latest from Week 13 of the NFL (all times EST): ___ 1:25 p.m. Minnesota wide receiver Adam Thielen hurt his left ankle on the game's opening drive and had his helmet off on the sideline the next time the Vikings had the ball in the first quarter at Detroit. Thielen entered the game tied for the league lead with 10 receiving touchdowns. Lions defensive tackle Nick Williams was also injured on the first possession, walking off the field holding his left hand and wrist. ___ 12:00 p.m. Arizona Cardinals quarterback Kyler Murray and three-time All-Pro receiver DeAndre Hopkins are active against the Chicago Bears after missing the previous three games because of injuries.",2021-12-05 16:55:55,[],[]
229,https://news.yahoo.com/officials-move-fire-arizona-officer-152606068.html,"Officials move to fire Arizona officer who shot man in wheelchair nine times, chief says","A U.K. parliamentary committee on Wednesday criticized government plans to deter migrants from trying to reach Britain in small boats, saying the measures will endanger lives without stopping dangerous journeys like the one that killed 27 people last week. British Prime Minister Boris Johnson has proposed legislation that would give authorities patrolling the English Channel the power to turn away boats carrying migrants. The Nationality and Borders Bill would also make it more difficult for people who enter the country illegally to claim asylum and allow asylum-seekers to be screened abroad.",2021-12-01 15:26:06,[],set()
230,https://sports.yahoo.com/lucas-raymond-goal-vs-seattle-024426617.html,Lucas Raymond with a Goal vs. Seattle Kraken,"The Detroit Red Wings' star rookies put on another entertaining performance as the Wings beat the expansion Kraken, 4-3, in a shootout.Michigan basketball travels to Chapel Hill, North Carolina to take on the Tar Heels in the ACC/Big Ten Challenge on Wednesday night, on ESPN.Several members of the Michigan football offense received postseason recognition from the coaches and the media.Detroit Red Wings forward Lucas Raymond was named rookie of the month for November.A 15-year-old boy in Michigan opened fire on his classmates Tuesday, killing at least three students and wounding several others.",2021-12-02 02:44:26,[],set()
231,https://www.startribune.com/gophers-womens-basketball-falls-to-unbeaten-north-carolina-in-big-ten-acc-challenge/600122872/,Gophers women's basketball falls to unbeaten North Carolina in Big Ten/ACC Challenge,"The Gophers women's basketball team had to know the offense, at times, would not come easily playing North Carolina on Wednesday night in the Big Ten/ACC challenge at Williams Arena. The Tar Heels can play defense, entering the game as the second-ranked team in the nation in field-goal defense; opponents shot 29% as North Carolina started the season 6-0. Make that 7-0 after a 82-76 victory over the Gophers (6-4). A 12-2 run that began with Deja Kelly's three-pointer from beyond midcourt at the third-quarter buzzer and ended with a three by Kennedy Todd-Williams less than three minutes into the fourth put the Tar Heels up 10, and they held on for the win.",2021-12-02 04:06:52,[],[]
232,https://www.startribune.com/washington-state-beats-arizona-state-51-29-to-open-pac-12/600122820/,Washington State beats Arizona State 51-29 to open Pac-12,"TEMPE, Ariz. — Noah Williams scored 14 points and Washington State overcame an ugly first half to open Pac-12 play with a 51-29 win over Arizona State on Wednesday night. The Cougars (6-1, 1-0 Pac-12) traded misses with the Sun Devils in a disjointed first half before running more their offense in the second. Washington State led by eight at halftime and stretched it to 21 with a big run to pull away from the flailing Sun Devils. Arizona State played without forward Marcus Bagley (knee) for the fifth straight game, but it may not have mattered who was on the court.",2021-12-02 02:49:32,[],[]
233,https://apnews.com/b323b45deb137e1328526512758ed9ff,The Latest: Vikings' Thielen hurts ankle early vs. Lions,"The Latest from Week 13 of the NFL (all times EST):1:25 p.m. Minnesota wide receiver Adam Thielen hurt his left ankle on the game's opening drive and had his helmet off on the sideline the next time the Vikings had the ball in the first quarter at Detroit.Thielen entered the game tied for the league lead with 10 receiving touchdowns.Lions defensive tackle Nick Williams was also injured on the first possession, walking off the field holding his left hand and wrist. ___ 12:00 p.m.Arizona Cardinals quarterback Kyler Murray and three-time All-Pro receiver DeAndre Hopkins are active against the Chicago Bears after missing the previous three games because of injuries.",2021-12-05 17:11:13,['yes'],set()
234,https://www.espn.com/nba/story/_/id/32746413/coach-tom-thibodeau-removes-struggling-kemba-walker-new-york-knicks-rotation?ex_cid=espnapi_affiliate_abcotv,Coach Tom Thibodeau removes struggling Kemba Walker from New York Knicks' rotation,"New York Knicks coach Tom Thibodeau told reporters Monday afternoon that he is removing guard Kemba Walker fromnot only the team's starting lineup but from the rotation as a whole, beginning with Tuesday's showdown with the crosstown rival Nets in Brooklyn.""It's a tough decision to make, but you always have to do what you think is best for the team,"" Thibodeau said after practice Monday in explaining his decision. ""I view Kemba as a starter, and so it'd be tough to play three small guards together.",2021-11-29 20:06:57,"[""Coach Tom Thibodeau said Monday he is removing Kemba Walker from the Knicks' rotation as he has &quot;to do what I think is best for the team.&quot;""]",set()
235,https://www.chron.com/sports/article/Young-makes-key-free-throws-leads-Hawks-past-16667783.php,"Young makes key free throws, leads Hawks past Pacers 114-111","1of9Atlanta Hawks' Delon Wright (0) goes to the basket against Indiana Pacers' Oshae Brissett (12) during the first half of an NBA basketball game Wednesday, Dec. 1, 2021, in Indianapolis.Darron Cummings/APShow MoreShow Less 2of9Atlanta Hawks' Trae Young (11) is defended by Indiana Pacers' Chris Duarte during the first half of an NBA basketball game Wednesday, Dec. 1, 2021, in Indianapolis.Darron Cummings/APShow MoreShow Less 4of9Atlanta Hawks' Delon Wright (0) goes to the basket against Indiana Pacers' Jeremy Lamb (26) during the first half of an NBA basketball game Wednesday, Dec.",2021-12-02 02:38:46,[],set()
236,https://www.voanews.com/a/the-inside-story-nurses-fatigue-transcript/6336826.html,The Inside Story-Nurses Fatigue TRANSCRIPT,"TRANSCRIPT 
The Inside Story: Pandemic Nursing Fatigue 
Episode 16 – December 2, 2021 Show Opening Graphic: Voice of CAROLYN PRESUTTI, VOA Correspondent: Inside the front lines of the pandemic. 
Overwhelmed by the unending number of the sickest -- and at times – the angriest of patients. 
The world's nurses find themselves running out of patience. Mawata Kamara, National Nurses United Member: If a nurse had to choose between you know, keeping her job and coming home, you know, with a broken jaw or coming home traumatized every day… CAROLYN PRESUTTI: With infections spiking … 
and concerns about the Omicron variant … 
Why are nurses burning out and checking out in record numbers? 
We explore on The Inside Story: Pandemic Nursing Fatigue.",2021-12-02 18:15:00,['COVID-19 Pandemic'],set()
237,https://www.dailymail.co.uk/wires/reuters/article-10274249/NBA-roundup-Stephen-Curry-Warriors-halt-Suns-18-game-win-streak.html,"NBA roundup: Stephen Curry, Warriors halt Suns' 18-game win streak","Published: 01:54 EST, 4 December 2021 | Updated: 01:54 EST, 4 December 2021 The Golden State Warriors ended the Phoenix Suns' 18-game winning streak and reclaimed the top spot in the Western Conference on Friday night, riding a long-range barrage led by Stephen Curry to a 118-96 victory in San Francisco. Curry finished with a game-high-tying 23 points, a majority coming on six of the Warriors' 19 3-pointers, as Golden State avenged a 104-96 loss at Phoenix on Tuesday by handing the Suns their first loss since Oct.",2021-12-04 06:54:26,"['dailymail', 'wires', 'reuters']",set()
238,https://apnews.com/3ad6ea222597eb232c36224c43ecfc11,Bucks pick up 8th win in a row behind Giannis' 40 points,"MILWAUKEE (AP) — Giannis Antetokounmpo scored on a driving layup with two seconds left to give Milwaukee a 127-125 victory over the Charlotte Hornets on Wednesday night, the Bucks' eighth consecutive victory.Antetokounmpo had 40 points and 12 rebounds and Khris Middleton added 21 points for the Bucks.LaMelo Ball had a career-high 36 points for the Hornets, followed by Kelly Oubre Jr. with 25 and Miles Bridges with 22 points. Middleton buried a 3-pointer from the top left to put Milwaukee in front 123-122 with 52 seconds left.",2021-12-02 04:02:01,['yes'],set()
239,https://www.startribune.com/the-latest-texans-taylor-benched-mills-at-qb-vs-colts/600124021/,"The Latest: Texans Taylor benched, Mills at QB vs. Colts",The Latest from Week 13 of the NFL (all times EST): ___ 3:15 p.m. Houston Texans quarterback Tyrod Taylor has been benched in the third quarter against the Indianapolis Colts. Taylor was evaluated for an undisclosed injured after a Houston's first possession of the third quarter but the team said he was available to play and it was coach David Culley's decision to insert backup Davis Mills in his place. Houston trailed 21-0 when Taylor was benched. Taylor threw an interception on the first play of the game and the Texans fumbled on their second possession before punting on their next four drives.,2021-12-05 16:55:55,[],[]
