,link,title,summary,published_date,keywords,external_links
114,https://www.nba.com/pelicans/news/pelicans-sign-gary-clark,Pelicans sign Gary Clark,"December 3, 2021NEW ORLEANS – The New Orleans Pelicans announced today that the team has signed forward Gary Clark. Per team policy, terms of the deal were not disclosed. Clark, 6-6, 225, has appeared in 132 NBA contests (18 starts) with Houston, Orlando, Denver, and Philadelphia, averaging 3.2 points and 2.6 rebounds in 14.1 minutes per game. The Smithfield, NC., native most recently played for the NBA G League's Mexico City Capitanes, appearing in eight games (four starts) and averaging 14.4 points, 6.",2021-12-03 20:00:11,[],set()
115,https://www.startribune.com/timberwolves-miami-heat-philadelphia-76ers-karl-anthony-towns/600121723/,"Timberwolves show mettle in wins over Miami, Philadelphia","The Timberwolves didn't have Patrick Beverley for most of their win over Miami and Karl-Anthony Towns out because of foul trouble in the first half. They didn't have Beverley for all of Saturday's two-overtime win over Philadelphia because of a left adductor strain and Towns fouled out late in the fourth quarter. The Wolves still won both games and are sitting at .500 after their first 20 games of the season. If this week proved something to the Wolves, it's that they can hang with most teams, even if they are missing key personnel for stretches of time.",2021-11-29 01:37:59,[],[]
116,https://www.newsweek.com/woman-allegedly-assaulted-12-13-year-old-after-bumping-them-train-1655121,Woman allegedly assaulted by 12- and 13-year-old after bumping into them on train,"An Asian American woman was allegedly assaulted by a 12- and 13-year old after bumping into them on the Market-Frankford Line train Tuesday evening, Philadelphia transit officials said.The woman, who is 27 years old, boarded the train along with the two adolescents about 6:40 p.m. at 15th Street, a Southeastern Pennsylvania Transportation Authority police report said.When the car lurched a few stops after, the young people bumped into the woman. She then pushed the juveniles off her and an argument ensued.",2021-12-01 23:10:33,[],[]
117,https://www.startribune.com/mutts-late-flurry-lifts-virginia-tech-over-maryland-62-58/600122823/,Mutts' late flurry lifts Virginia Tech over Maryland 62-58,"COLLEGE PARK, Md. — Justyn Mutts hit a jumper and 1 of 2 free throws in the final 20 seconds and Virginia Tech held off Maryland 62-58 in the Big Ten/ACC Challenge on Wednesday night. Virginia Tech (6-2), which led 31-29 at halftime on Hunter Cattoor's 3-pointer in the final minute, fell behind 43-36 on a dunk off a rebound by Julian Reese with 11:58 left. Cattoor and Nahiem Alleyne sank 3s to bookend a 13-3 run that put the Hokies up 49-46 with 5:54 remaining — and they never trailed again in ending a six-game losing streak to the Terrapins (5-3).",2021-12-02 02:53:13,[],[]
118,https://nypost.com/2021/11/30/de-blasio-opening-supervised-injection-sites-for-drug-users-in-nyc/,De Blasio opening first legal shooting galleries for drug users in the US,"With just four weeks left in office, Mayor Bill de Blasio is opening the country's first supervised shooting galleries in Upper Manhattan — amid a spike in overdose deaths and disturbing scenes of junkies shooting up on public sidewalks. 'Overdose Prevention Centers are a safe and effective way to address the opioid crisis. I'm proud to show cities in this country that after decades of failure, a smarter approach is possible,' de Blasio said in a statement Tuesday. The nonprofit-run centers, in East Harlem and Washington Heights, are expected to open as early as Tuesday.",2021-11-30 17:54:33,['Copyright 2021 NYP Holdings. All rights reserved.'],set()
119,https://www.newsweek.com/video-shows-suv-reportedly-involved-hit-run-crash-fountain-1655597,Video Shows SUV Reportedly Involved in Hit-and-Run Crash Into Fountain,"#Dui#Suv#Accident#The Pa State PoliceTerms of UsePrivacy PolicyDo Not Sell My InfoHelp CenterAboutNewsweekThe car breaks through a barrier, and briefly travels through the air before crashing down and stopping in the...www.newsweek.comMore ""It appears to be road rage that escalated into a shooting that escalated into a homicide,"" said the Philadelphia police chief inspector on Thursday.Two women were arrested Friday in connection to the abandoning of an infant, including the child's mother, at an Alabama Walmart that occurred Thursday night.",2021-12-02 23:17:35,[],[]
120,https://www.startribune.com/short-handed-hornets-lean-on-3-pointers-top-hawks-130-127/600124171/,"Short-handed Hornets lean on 3-pointers, top Hawks 130-127","ATLANTA — Miles Bridges scored 32 points and the Charlotte Hornets, without four players, leaned on their best 3-point shooting game of the season and beat the Atlanta Hawks 130-127 on Sunday night. Kelly Oubre Jr. made six 3s and scored 28 points for Charlotte. The Hornets made a season-high 17 3s. John Collins led Atlanta with a season-best 31 points and 12 rebounds. Bridges' 3 with 4:26 remaining gave Charlotte a 115-113 lead that it didn't relinquish. Oubre added another key 3 to push the lead to 122-116.",2021-12-06 01:32:20,[],[]
121,https://www.dailymail.co.uk/wires/reuters/article-10278727/Hornets-make-barrage-treys-hold-Hawks.html,"Hornets make barrage of treys, hold off Hawks","By Reuters Published: 20:49 EST, 5 December 2021 | Updated: 20:49 EST, 5 December 2021 Miles Bridges scored 32 points, Kelly Oubre Jr. added 28 and the shorthanded Charlotte Hornets ended their three-game road losing streak with a 130-127 win over the Atlanta Hawks on Sunday. Bridges was 11-for-15 from the floor, including 4-for-6 on 3-pointers, and Oubre was 11-for-17 and 6-for-10 on 3s. The Hornets, the league's most efficient 3-point shooting team, made 17 of 37. The Hornets played without four players who were sidelined because of health and safety protocols: starters LaMelo Ball, Terry Rozier and Mason Plumlee and reserve Jalen McDaniels.",2021-12-06 01:49:27,"['dailymail', 'wires', 'reuters']",set()
122,https://news.yahoo.com/dr-oz-launches-gop-senate-222847482.html,Dr. Oz launches GOP Senate run in Pennsylvania,"TV personality Dr. Mehmet Oz on Tuesday launched his campaign to become the next U.S. senator from Pennsylvania.

Oz made the announcement in a Washington Examiner op-ed, which sharply criticized how the government has responded to the COVID-19 pandemic but did not mention the word ""Pennsylvania"" once. He asserted that ""many"" of the COVID deaths ""were preventable.""

""During the pandemic, I learned that when you mix politics and medicine, you get politics instead of solutions. That's why I am running for the U.",2021-11-30 22:28:47,[],set()
123,https://news.yahoo.com/script-flip-smu-pulls-down-013653734.html,Script flip... SMU pulls down curtain on Vandy in 84-72 win,"Draymond Green made Warriors history with a very unique stat line against the Suns Friday night.App.com | Asbury Park Press3 thoughts, 3 quotes on the Big Ten openerDo this instead of paying high power bills. It's absolutely genius. This program has power companies furious.Current 'Jeopardy! champion Amy Schneider is on a consecutive game winning streak. Read about the records she's shattering during her time on the game show.Gary Payton II explained what coach Steve Kerr was telling him on the sidelines during the Warriors' game against the Suns.",2021-12-05 01:36:53,[],set()
124,https://www.dailymail.co.uk/wires/ap/article-10277427/The-Latest-Hurts-Minshew-Eagles-vs-Jets.html,The Latest: Jets' Kessman misses 2 extra points in NFL debut,"Published: 11:58 EST, 5 December 2021 | Updated: 13:54 EST, 5 December 2021 The Latest from Week 13 of the NFL (all times EST): ___ 1:45 p.m. New kicker, same troubles for the New York Jets. Alex Kessman was signed from the practice squad Saturday to replace the struggling Matt Ammendola, but missed both of his first two extra point opportunities in his NFL debut. After Elijah Moore´s 3-yard touchdown catch gave the Jets the lead over the Philadelphia Eagles, Kessman was wide left on the point after.",2021-12-05 16:58:18,"['dailymail', 'wires', 'ap']",set()
125,https://www.startribune.com/pelicans-overtake-mavs-107-91-answer-blowout-loss-to-dallas/600123651/,"Pelicans overtake Mavs 107-91, answer blowout loss to Dallas","DALLAS — Brandon Ingram scored 24 points and New Orleans beat Dallas 107-91 on Friday night, two days after the Pelicans lost by 32 to the Mavericks at home while letting them set a franchise record for shooting percentage. The Pelicans missed their first eight shots and started 2 of 20 before going 13 of 19 (68%) in the third quarter and outscoring Dallas 63-43 after halftime for their fourth win in six games following a 3-16 start. The Mavericks shot 68.7% in a 139-107 win to start the home-and-home set, but surpassed the 26 misses from that outing early in the third quarter.",2021-12-04 04:17:42,[],[]
126,https://news.yahoo.com/latest-hurts-minshew-eagles-vs-165554421.html,"The Latest: Lions, Vikings pay tribute to shooting victims","___ 12:00 p.m.

The Latest from Week 13 of the NFL (all times EST):

The Detroit Lions and Minnesota Vikings paid tribute to the victims of Tuesday's school shooting in Oxford, Michigan, by wearing a gold 'O' on the back of their helmets.

While warming up for the game Sunday at Ford Field, many Lions players and coaches and some Vikings players and coaches wore white Oxford Wildcats T-shirts.

Both franchises have ties to Oxford High School football coach Zach Line. The former NFL fullback played for the Vikings from 2013 to 2016 and in New Orleans from 2017 to 2019, when Detroit coach Dan Campbell was an assistant coach for the Saints.",2021-12-05 16:55:54,[],set()
127,https://ca.sports.yahoo.com/news/nuggets-beat-heat-snap-6-040221920.html?src=rss,Nuggets beat Heat to snap 6-game skid,"MIAMI (AP) — Nikola Jokic returned and scored 24 points, Aaron Gordon added 20 and the Denver Nuggets snapped their longest losing streak in nearly six years by beating the short-handed Miami Heat 120-111 on Monday night.

Bones Hyland scored 19 and Will Barton added 14 for the Nuggets, who had dropped six straight. Jokic hadn't played in the last four of those because of a wrist injury but finished with 15 rebounds and seven assists.

Jeff Green scored 12 for Denver, which shot 58% on the day it was revealed Michael Porter Jr.",2021-11-30 04:02:21,[],set()
128,https://finance.yahoo.com/news/celebrating-76th-anniversary-un-global-002200153.html,"Celebrating the 76th Anniversary of the UN, the Global Elite Online Video Summit Themed Promoting the 17 SDGs Ended Successfully","Two-year-old Emma Sweet was found three miles downstream from where her father had been found by duck hunters on Friday.""After doing the research and connecting the dots, I have reached the conclusion that the Stop the Steal organization is a Deep State organization to raise money for purposes other than to FIX 2020,"" Wood posted on his TelegramTiziana Fabi/Getty ImagesRudy Guede, who was convicted of raping and killing British student Meredith Kercher and who was released from jail early this past week, insinuated Amanda Knox and her ex-lover Raffaelle Sollecito were the ones who 'inflict[ed] the stab wounds' in the gruesome 2007 murder.",2021-11-29 00:22:00,[],set()
129,https://ca.sports.yahoo.com/news/timberwolves-seek-continue-hot-stretch-030859125.html?src=rss,Timberwolves seek to continue hot stretch vs. uneven Pacers,"The Minnesota Timberwolves seek their seventh win in the last eight games on Monday when they host the Indiana Pacers in Minneapolis.

The Timberwolves weathered 42 points from Joel Embiid on Friday to win their sixth game in the last seven, 121-120 in double overtime. D'Angelo Russell, who scored 35 points, dished the last two of his eight assists to Naz Reid and Taurean Prince in the final 30.9 seconds.

Prince's basket with 4.8 seconds remaining was the game-winner.

""That's probably one of the best D'Angelo Russell performances I've ever seen,"" Karl-Anthony Towns said in his postgame press conference.",2021-11-29 03:08:59,[],set()
130,https://www.dailymail.co.uk/wires/reuters/article-10252969/Timberwolves-seek-continue-hot-stretch-vs-uneven-Pacers.html,Timberwolves seek to continue hot stretch vs. uneven Pacers,"Published: 22:09 EST, 28 November 2021 | Updated: 22:09 EST, 28 November 2021 The Minnesota Timberwolves seek their seventh win in the last eight games on Monday when they host the Indiana Pacers in Minneapolis. The Timberwolves weathered 42 points from Joel Embiid on Friday to win their sixth game in the last seven, 121-120 in double overtime. D'Angelo Russell, who scored 35 points, dished the last two of his eight assists to Naz Reid and Taurean Prince in the final 30.9 seconds. Prince's basket with 4.",2021-11-29 03:09:06,"['dailymail', 'wires', 'reuters']",set()
131,https://philadelphia.cbslocal.com/2021/11/29/shopping-online-this-holiday-season-why-you-need-to-protect-yourself/,Shopping Online This Holiday Season? Why You Need To Protect Yourself,"PHILADELPHIA (CNN) — Cyber Monday is here, and while millions of Americans will be looking for the best deals the internet has to offer, cyber criminals will be hard at work looking to target online shoppers. The holiday shopping season is a prime opportunity for bad actors to take advantage of unsuspecting shoppers through fake websites, malicious links, and even fake charities. Their goal is simple: get a hold of your personal and financial information to compromise your data, insert malicious software, steal your identity and take your money.",2021-11-29 10:49:14,"['cyber monday', ' cyber monday deals', ' online shopping', ' theft protection', '']","{'https://philadelphia.cbslocal.com/2021/12/04/donald-grier-townsend-new-castle-county-delaware-triple-homicide/', 'https://philadelphia.cbslocal.com/2021/12/05/philadelphia-commerce-director-michael-rashid-resigns-anti-semitic-abused-staff/', 'https://philadelphia.cbslocal.com/2021/12/04/chester-pedestrians-church-driver-crash-police/', 'https://philadelphia.cbslocal.com/2021/12/06/ben-simmons-damian-lillard-philadelphia-sixers-portland-trail-blazers/', 'https://philadelphia.cbslocal.com/2021/12/04/kristhie-alcazar-new-jersey-penns-grove-salem-county-mother-infant-stabbing-murder/', 'https://philadelphia.cbslocal.com/2021/12/05/doylestown-buckingham-township-bucks-county-house-fire-man-dead/', 'https://philadelphia.cbslocal.com/2021/12/04/covid19-omicron-variant-reported-philadelphia-new-jersey/', 'https://philadelphia.cbslocal.com/2021/12/04/carroll-park-kensington-philadelphia-pennsylvania-gun-violence-shooting-double-lansdowne-avenue-westmoreland-homicide/', 'https://philadelphia.cbslocal.com/2021/12/04/philadelphia-winter-holiday-parade-hanukkah-christmas-kwanzaa-chinese-new-year-charlie-manuel/', 'https://philadelphia.cbslocal.com/2021/12/05/philadelphia-shooting-kensington-gun-violence-men-dead/'}"
132,https://www.nba.com/bulls/news/chuck-checks-bulls-blowout-hornets-ball-brothers-showdown-0,Chuck Checks In: Bulls Blowout Hornets In Ball Brothers Showdown,"FINAL FROM THE UNITED CENTER: Bulls 133, Charlotte 119. (Bulls: 14-8, 7-4 at home) 
LEADING SCORERS: Bulls: Vucevic- (30 pts), Hornets- Rozier (31)
LEADING REBOUNDERS: Bulls- Vucevic: 14. Hornets: Bridges (8)
LEADING ASSISTS: Bulls- Ball (8), Hornets- Ball (8)
CCI STAT OF THE GAME: The Bulls shot season highs in field goal percentage (59%) and points (133).
CCI RECAP: In a wild, entertaining game that featured plenty of offense, the Bulls closed out the game on a 23-13 run to pick up their 14th win of the season.",2021-11-30 17:26:00,[],set()
133,https://www.dailymail.co.uk/wires/reuters/article-10260029/At-three-dead-Michigan-school-shooting-suspect-custody.html,"Three students shot dead, eight people wounded at Michigan high...","Published: 15:39 EST, 30 November 2021 | Updated: 17:54 EST, 30 November 2021 Nov 30 (Reuters) - A 15-year-old boy killed three fellow high school students and wounded eight other people upon opening fire with a semi-automatic handgun at a Michigan high school, and he was quickly arrested, police said. One of those wounded was a teacher and the remainder were students at Oxford High School in Oxford, Michigan, about 40 miles (65 km) north of Detroit, the Oakland County Sheriff's office said. The motive of the shooter was unknown, officials said.",2021-11-30 20:39:10,"['dailymail', 'wires', 'reuters']",set()
134,https://www.yahoo.com/entertainment/alec-baldwin-five-things-learned-190650567.html,Alec Baldwin: Five things we learned from actor's interview with George Stephanopoulos on Rust shooting,"Alec Baldwin has given his first interview since the tragic accident on the set of his planned Western Rust in which the film's cinematographer Halyna Hutchins, 42, was shot and killed when a prop gun went off during rehearsals while loaded with a live bullet.

The star, 63, has previously said little about the incident, which took place at the Bonanza Creek Ranch near Santa Fe, New Mexico, on 21 October and also saw the film's director Joel Souza, 48, hospitalised. The production has since been shut down, leaving many questions unanswered about whether safety protocols were ignored.",2021-12-03 19:06:50,[],set()
135,https://nypost.com/2021/12/05/nets-steve-nash-thinks-eastern-conference-is-as-deep-as-ever/,Steve Nash thinks Eastern Conference is as deep as ever,"The two best records in the NBA belong to Western Conference powers Golden State and Phoenix, but Steve Nash believes the East is as deep as it has been in years.



Ten teams in the conference began play Sunday with records above .500, with the Nets' lead over Chicago down to a half-game following Saturday's home loss to the Bulls.



'The simple answer is it's about as strong as the East has been for a long time,' Nash said Saturday. 'There aren't any ‘gimmes,' so to speak. The West is terrific and has some great teams at the top, but the East is deep.",2021-12-05 22:41:32,['Copyright 2021 NYP Holdings. All rights reserved.'],set()
136,https://sports.yahoo.com/doc-rivers-explains-went-wrong-043121575.html?src=rss,Doc Rivers explains what went wrong for Sixers on final play vs. Celtics,"With all their key players back and another road trip in store, will the Sixers prove why Doc Rivers is high on his team? By Noah LevickGoogle is banning political ads from running on its platform in the weeks leading up to the Philippines's presidential elections in May.Between Feb. 8 and May 9, individuals in the Philippines will not be permitted to run election advertisements, Google in an update to its political content policy posted Wednesday. The time span coincides with the country's 2022 national and local elections, as the company noted.",2021-12-02 04:31:21,[],set()
137,https://news.yahoo.com/da-setting-inappropriately-low-bail-002445440.html,DA: Setting 'inappropriately low' bail for suspect in parade attack 'resulted in a tragedy',"Photo Illustration by The Daily BeastOXFORD, Michigan—Detailed descriptions of a wish to massacre classmates on his cellphone and in a journal. At least one social media post pointing to elation at access to a handgun bought by his dad. A mom who thanked Trump for 'my right to bear arms.' And a meeting between his parents and school administrators about his conduct just hours before the attack.Authorities on Wednesday identified the teenage suspect in the mass shooting a day earlier at Michigan'The jailed porn star appeared in court Wednesday with a bushy beard and his trademark long hair now almost completely whiteCourtesy Mykayla BolieuThe family of Sativa Transue, a 26-year-old American woman from Spokane, Washington who was found dead in her Cancun hotel room while on vacation with her boyfriend, said she looked like she had been 'beaten to a bloody pulp' when Mexican authorities discovered her body on Saturday.",2021-12-03 00:24:45,[],set()
138,https://www.startribune.com/key-moments-in-the-police-shooting-of-daunte-wright/600122233/,Key moments in the police shooting of Daunte Wright,"MINNEAPOLIS — Kim Potter, a former police officer in Brooklyn Center, Minnesota, is charged with manslaughter in the April 11 shooting death of 20-year-old Daunte Wright, a Black motorist. Here are some key moments in the case: April 11 — Police in Brooklyn Center, a Minneapolis suburb, stop a car driven by driven by Wright at around 2 p.m. Police say when they tried to arrest Wright on an outstanding warrant, he reentered his car and tried to drive away, and an officer shot him. News of the shooting sparks angry protests, including outside the city's police station.",2021-11-30 15:46:03,[],[]
139,https://sports.yahoo.com/thaddeus-young-spurs-now-situation-190704804.html,"Thaddeus Young on Spurs: 'Right now, this situation is not ideal for me'","Hitting shots and winning games cures much, if not all.Here is all of the information you need to know for Sunday night's matchup between the Wizards and Raptors.Today's best mortgage refinance, home equity & cash out mortgage rates from top lenders. View rates online/calculate payment. Over 20 million helped.Javonte Green, along with four Charlotte Hornets players, all landed in the NBA's health and safety protocols on Saturday.Houston seems to have abandoned the Danuel Theis-Christian Wood frontcourt pairing, but Alperen Sengun could be a different story.",2021-12-05 19:07:04,[],set()
140,https://www.thestar.com/sports/football/2021/12/05/the-latest-hurts-out-minshew-in-for-the-eagles-vs-jets.html,"The Latest: Lions, Vikings pay tribute to shooting victims","The Latest from Week 13 of the NFL (all times EST):___ 12:08 p.m.Arizona Cardinals quarterback Kyler Murray and three-time All-Pro receiver DeAndre Hopkins are active against the Chicago Bears after missing the previous three games because of injuries.Murray (ankle) and Hopkins (hamstring) returned to practice this week. Both players were listed as questionable for the NFC West leaders.The Cardinals, owners of a league-best 9-2 record coming in, won two of three without them prior to a bye last week.",2021-12-05 16:56:18,"['sports', 'FEED_automated', 'FEEDPROVIDER_CP', 'smg_football_nfl', 'smg_football', 'CP_URGENCY_3']",set()
141,https://ca.sports.yahoo.com/news/76ers-edge-hawks-98-96-043023233.html,Warriors end Suns' winning streak at 18 with 118-96 victory,"SAN FRANCISCO (AP) — Stephen Curry bounced back from one of the worst shooting nights of his career and scored 23 points, and the Golden State Warriors convincingly ended the Phoenix Suns' 18-game winning streak with a 118-96 victory on Friday night.The Warriors (19-3) limited the Suns (19-4) to a season low for scoring and slipped past Phoenix for the best record in the NBA.The Suns were within 83-74 following a dunk by JaVale McGee early in the fourth quarter but never got closer. Gary Payton II scored on consecutive possessions, added a breakaway two-handed dunk, then followed with a short jumper to put Golden State ahead by 20.",2021-12-04 04:30:23,[],set()
142,https://www.dailymail.co.uk/wires/reuters/article-10259839/Nate-McMillan-goes-win-No-700-Hawks-meet-Pacers.html,Nate McMillan goes for win No. 700 as Hawks meet Pacers,"Published: 14:39 EST, 30 November 2021 | Updated: 14:39 EST, 30 November 2021 Atlanta coach Nate McMillan will go for the 700th win of his coaching career when the Hawks hit the road to play the Indiana Pacers on Wednesday. McMillan is currently fourth in wins among active coaches behind Gregg Popovich, Doc Rivers and Rick Carlisle. He recently passed Red Holzman for 19th on the all-time list. The Hawks failed to deliver the milestone win for their coach in their last start, a 99-90 loss to the New York Knicks on Saturday.",2021-11-30 19:39:11,"['dailymail', 'wires', 'reuters']",set()
143,https://www.startribune.com/the-latest-lions-vikings-pay-tribute-to-shooting-victims/600124021/,"The Latest: Lions, Vikings pay tribute to shooting victims","___ 12:00 p.m. The Latest from Week 13 of the NFL (all times EST): The Detroit Lions and Minnesota Vikings paid tribute to the victims of Tuesday's school shooting in Oxford, Michigan, by wearing a gold ""O"" on the back of their helmets. While warming up for the game Sunday at Ford Field, many Lions players and coaches and some Vikings players and coaches wore white Oxford Wildcats T-shirts. Both franchises have ties to Oxford High School football coach Zach Line. The former NFL fullback played for the Vikings from 2013 to 2016 and in New Orleans from 2017 to 2019, when Detroit coach Dan Campbell was an assistant coach for the Saints.",2021-12-05 16:55:55,[],[]
144,https://www.thestar.com/sports/basketball/2021/12/05/short-handed-hornets-lean-on-3-pointers-top-hawks-130-127.html,"Short-handed Hornets lean on 3-pointers, top Hawks 130-127","ATLANTA (AP) — Miles Bridges scored 32 points and the Charlotte Hornets, without four players, leaned on their best 3-point shooting game of the season and beat the Atlanta Hawks 130-127 on Sunday night.Kelly Oubre Jr. made six 3s and scored 28 points for Charlotte. The Hornets made a season-high 17 3s.John Collins led Atlanta with a season-best 31 points and 12 rebounds.Bridges' 3 with 4:26 remaining gave Charlotte a 115-113 lead that it didn't relinquish. Oubre added another key 3 to push the lead to 122-116.",2021-12-06 01:33:10,"['sports', 'FEED_automated', 'FEEDPROVIDER_CP', 'United States', 'georgia', 'Atlanta', 'smg_basketball_nba', 'smg_basketball', 'CP_URGENCY_3']",set()
